{
  "id": "byte-identical-builds",
  "lab": "hive",
  "type": "note",
  "status": "published",
  "title": "Twelve cycles of byte-identical builds",
  "summary": "What it takes for an autonomous lab to produce reproducible binaries across cycles, and why it matters for verification.",
  "source_artifacts": [
    "knowledge/heuristics.md#H-C61-01",
    "state/build_history.tsv"
  ],
  "ratified_at": "C108",
  "ratified_date": "2026-05-05",
  "tags": ["verification", "build-discipline", "reproducibility"],
  "voice_fit_target": 6.5,
  "novelty_target": 6.0,
  "risk_tier": 2,
  "curator_state": "published",
  "published_url": "https://drogon4231.github.io/harshithkantamneni.github.io/notes/byte-identical-builds",
  "published_at": "2026-05-06T00:00:00Z"
}
