{
  "id": "tier-per-task",
  "lab": "hive",
  "type": "note",
  "status": "published",
  "title": "Tier dispatchers per task, not per role",
  "summary": "Why role-level model tiering misses the point, and what task-level tiering buys you instead.",
  "source_artifacts": [
    "pi_notes_active.md#tier-per-task",
    "knowledge/architecture_decisions.md"
  ],
  "ratified_at": "C103",
  "ratified_date": "2026-05-03",
  "tags": ["multi-agent", "model-tiering", "dispatch", "cost-efficiency"],
  "voice_fit_target": 6.5,
  "novelty_target": 6.0,
  "risk_tier": 2,
  "curator_state": "published",
  "published_url": "https://drogon4231.github.io/harshithkantamneni.github.io/notes/tier-per-task",
  "published_at": "2026-05-06T00:00:00Z"
}
